QuesID,    AnsCount,    QuesTitle
39768230,1,"Converting python tuple, lists, dictionaries containing pandas objects (series/dataframes) to json"
39728551,0,How to handle JSON documents that have float values with no leading zeroes before decimal points?
39720332,1,Pandas `read_json` function converts strings to DateTime objects even the `convert_dates=False` attr is specified
39659146,1,Pandas DataFrame with date and time from JSON format
39634369,1,4 dimensional nested dictionary to pandas data frame
39632248,1,How to import normalised json data from several files into a pandas dataframe?
39612240,1,Writing pandas DataFrame to JSON in unicode
39604461,1,API Call - Multi dimensional nested dictionary to pandas data frame
39593821,2,Convert a dict to a pandas DataFrame
