QuesID,    AnsCount,    QuesTitle
39775828,3,Extract series objects from Pandas DataFrame
39747222,2,Add column to dataframe based on date column range
39734836,1,Join Python dataframe time series efficiently
39708133,1,TypeError: can&#39;t multiply sequence by non-int of type &#39;float&#39; (python 2.7)
39662149,0,pandas: extract date and time from timestamp
39648163,2,python pandas parse date without delimiters &#39;time data &#39;060116&#39; does not match format &#39;%dd%mm%YY&#39; (match)&#39;
39625328,2,Pandas Grouping By Datetime
39604586,1,Pandas apply with list output gives ValueError once df contains timeseries
39578466,2,pandas date to string
